"scenario_id","mechanism","input_expr","expected_status","expected_observable","notes"
"ABS-EP-001","Range.Formula","=ABS(-2)","observed","observed_value_eq:2","Worksheet entry baseline for unary ABS."
"ABS-EP-002","Range.Formula","=ABS()","failed","notes_contains:0x800A03EC&&execution_status_eq:failed","Intentional admission-failure sentinel at worksheet entrypoint."
"ABS-EP-003","Application.Evaluate","=ABS(-2)","observed","observed_value_eq:2","Evaluate path for unary ABS."
"ABS-EP-004","Application.Evaluate","=ABS(""asd"")","observed","","Evaluate path on coercion error lane."
"ABS-EP-005","Worksheet.Evaluate","=ABS(-2)","observed","observed_value_eq:2","Worksheet evaluate path for unary ABS."
"ABS-EP-006","Worksheet.Evaluate","=ABS(""asd"")","observed","","Worksheet evaluate path on coercion error lane."
"ABS-EP-007","WorksheetFunction.Abs","number:-2","failed","","COM WorksheetFunction path with numeric arg (method is not exposed in this COM dispatch surface for this baseline)."
"ABS-EP-008","WorksheetFunction.Abs","text:asd","failed","","COM WorksheetFunction path with text arg."
