"function_name","category","version_marker","tier","tier_label","description"
"XOR","Logical functions","","1","regular_pure_or_low_risk","Returns a logical exclusive OR of all arguments"
"YEAR","Date and time functions","","2","baseline_context","Converts a serial number to a year"
"YEARFRAC","Date and time functions","","2","baseline_context","Returns the year fraction representing the number of whole days between start_date and end_date"
"YIELD","Financial functions","","1","regular_pure_or_low_risk","Returns the yield on a security that pays periodic interest"
"YIELDDISC","Financial functions","","1","regular_pure_or_low_risk","Returns the annual yield for a discounted security; for example, a Treasury bill"
"YIELDMAT","Financial functions","","1","regular_pure_or_low_risk","Returns the annual yield of a security that pays interest at maturity"
"Z.TEST","Statistical functions","","1","regular_pure_or_low_risk","Returns the one-tailed probability-value of a z-test"
"ZTEST","Compatibility","","2","baseline_context","Returns the one-tailed probability-value of a z-test"
