scenario_id,lane,setup_values,formula,expected_text,notes
W22CRIT-001,W22-CRITERIA-SHAPE,"A1:=1|A2:=1|A3:=1|A4:=1|A5:=1|A6:=1|B1:=10|B2:=20|B3:=30|B4:=40|B5:=50|B6:=60|C1:=100|C2:=200|C3:=300|C4:=400|C5:=500|C6:=600","AVERAGEIF(A1:A3,1,B2)","30","AVERAGEIF anchors a single-cell average_range from its top-left cell over the criteria-range shape."
W22CRIT-002,W22-CRITERIA-SHAPE,"A1:=1|A2:=1|A3:=1|A4:=1|A5:=1|A6:=1|B1:=10|B2:=20|B3:=30|B4:=40|B5:=50|B6:=60|C1:=100|C2:=200|C3:=300|C4:=400|C5:=500|C6:=600","AVERAGEIF(A1:A4,1,B2:B3)","35","AVERAGEIF anchors the top-left of a smaller average_range and uses the criteria-range height."
W22CRIT-003,W22-CRITERIA-SHAPE,"A1:=1|A2:=1|A3:=1|A4:=1|A5:=1|A6:=1|B1:=10|B2:=20|B3:=30|B4:=40|B5:=50|B6:=60|C1:=100|C2:=200|C3:=300|C4:=400|C5:=500|C6:=600","AVERAGEIFS(B2, A1:A3, 1)","#VALUE!","AVERAGEIFS remains exact-shape on this baseline."
W22CRIT-004,W22-CRITERIA-SHAPE,"A1:=1|A2:=1|A3:=1|A4:=1|A5:=1|A6:=1|B1:=10|B2:=20|B3:=30|B4:=40|B5:=50|B6:=60|C1:=100|C2:=200|C3:=300|C4:=400|C5:=500|C6:=600","SUMIFS(B2, A1:A3, 1)","#VALUE!","SUMIFS remains exact-shape on this baseline."
W22CRIT-005,W22-CRITERIA-SHAPE,"A1:=1|A2:=1|A3:=1|A4:=1|A5:=1|A6:=1|B1:=10|B2:=20|B3:=30|B4:=40|B5:=50|B6:=60|C1:=100|C2:=200|C3:=300|C4:=400|C5:=500|C6:=600","COUNTIFS(A1:A3,1,B2,"">0"")","#VALUE!","COUNTIFS remains exact-shape on this baseline."
W22CRIT-006,W22-CRITERIA-SHAPE,"A1:=1|A2:=1|A3:=1|A4:=1|A5:=1|A6:=1|B1:=10|B2:=20|B3:=30|B4:=40|B5:=50|B6:=60|C1:=100|C2:=200|C3:=300|C4:=400|C5:=500|C6:=600","MAXIFS(B2, A1:A3, 1)","#VALUE!","MAXIFS remains exact-shape on this baseline."
W22CRIT-007,W22-CRITERIA-SHAPE,"A1:=1|A2:=1|A3:=1|A4:=1|A5:=1|A6:=1|B1:=10|B2:=20|B3:=30|B4:=40|B5:=50|B6:=60|C1:=100|C2:=200|C3:=300|C4:=400|C5:=500|C6:=600","MINIFS(B2, A1:A3, 1)","#VALUE!","MINIFS remains exact-shape on this baseline."
W22CRIT-008,W22-CRITERIA-SHAPE,"A1:=1|A2:=1|A3:=1|A4:=1|A5:=1|A6:=1|B1:=10|B2:=20|B3:=30|B4:=40|B5:=50|B6:=60|C1:=100|C2:=200|C3:=300|C4:=400|C5:=500|C6:=600","SUMIFS(B2:B4, A1:A3, 1)","90","SUMIFS still succeeds when the sum_range exactly matches the criteria-range shape."
